{
  "$schema": "https://json-schema.org/draft/2020-12/schema",
  "$id": "https://lowcode.example/schemas/theme.schema.json",
  "title": "Theme of a KinetiX application",
  "description": "Design tokens of a theme. The runtime applies them as CSS custom properties (--lc-*). The allowed values are deliberately restricted: a theme cannot inject arbitrary CSS.",
  "type": "object",
  "required": [
    "schemaVersion",
    "theme",
    "tokens"
  ],
  "properties": {
    "schemaVersion": {
      "const": "1.0"
    },
    "theme": {
      "type": "string",
      "pattern": "^[a-z][a-z0-9-]{1,63}$",
      "description": "Identifier of the theme."
    },
    "label": {
      "type": "string",
      "maxLength": 80
    },
    "mode": {
      "enum": [
        "light",
        "dark"
      ],
      "description": "Helps the runtime set color-scheme."
    },
    "tokens": {
      "$ref": "#/$defs/tokens"
    }
  },
  "additionalProperties": false,
  "$defs": {
    "color": {
      "type": "string",
      "pattern": "^(#[0-9a-fA-F]{3,8}|(rgb|hsl)a?\\([0-9.,%\\s/]+\\))$"
    },
    "tokens": {
      "type": "object",
      "required": [
        "colors"
      ],
      "properties": {
        "colors": {
          "type": "object",
          "required": [
            "primary",
            "onPrimary",
            "background",
            "surface",
            "onSurface",
            "border"
          ],
          "properties": {
            "primary": {
              "$ref": "#/$defs/color"
            },
            "onPrimary": {
              "$ref": "#/$defs/color"
            },
            "background": {
              "$ref": "#/$defs/color"
            },
            "surface": {
              "$ref": "#/$defs/color"
            },
            "onSurface": {
              "$ref": "#/$defs/color"
            },
            "mutedText": {
              "$ref": "#/$defs/color"
            },
            "border": {
              "$ref": "#/$defs/color"
            },
            "danger": {
              "$ref": "#/$defs/color"
            },
            "success": {
              "$ref": "#/$defs/color"
            }
          },
          "additionalProperties": false
        },
        "typography": {
          "type": "object",
          "properties": {
            "fontFamily": {
              "type": "string",
              "pattern": "^[A-Za-z0-9 ,'\"-]{1,200}$"
            },
            "baseSize": {
              "type": "number",
              "minimum": 12,
              "maximum": 20,
              "description": "Base size in px."
            }
          },
          "additionalProperties": false
        },
        "shape": {
          "type": "object",
          "properties": {
            "radius": {
              "type": "number",
              "minimum": 0,
              "maximum": 24,
              "description": "Corner radius in px."
            }
          },
          "additionalProperties": false
        },
        "density": {
          "enum": [
            "compact",
            "comfortable"
          ]
        },
        "layout": {
          "type": "object",
          "description": "Look of the application shell: side bar, top bar, page header, spacing. All optional: if missing, the side bar is light (surface colours) and the measures are those of Ant Design Pro.",
          "properties": {
            "sider": {
              "type": "object",
              "properties": {
                "tone": {
                  "enum": [
                    "light",
                    "dark"
                  ],
                  "description": "Style of the menu: light or dark."
                },
                "background": {
                  "$ref": "#/$defs/color"
                },
                "text": {
                  "$ref": "#/$defs/color"
                },
                "mutedText": {
                  "$ref": "#/$defs/color"
                },
                "activeBackground": {
                  "$ref": "#/$defs/color"
                },
                "activeText": {
                  "$ref": "#/$defs/color"
                },
                "border": {
                  "$ref": "#/$defs/color"
                },
                "width": {
                  "type": "number",
                  "minimum": 180,
                  "maximum": 360,
                  "description": "Width in px."
                },
                "collapsedWidth": {
                  "type": "number",
                  "minimum": 48,
                  "maximum": 120,
                  "description": "Collapsed width in px."
                }
              },
              "additionalProperties": false
            },
            "header": {
              "type": "object",
              "properties": {
                "background": {
                  "$ref": "#/$defs/color"
                },
                "text": {
                  "$ref": "#/$defs/color"
                },
                "border": {
                  "$ref": "#/$defs/color"
                },
                "height": {
                  "type": "number",
                  "minimum": 40,
                  "maximum": 96,
                  "description": "Height in px."
                }
              },
              "additionalProperties": false
            },
            "pageHeader": {
              "type": "object",
              "properties": {
                "background": {
                  "$ref": "#/$defs/color"
                },
                "text": {
                  "$ref": "#/$defs/color"
                },
                "mutedText": {
                  "$ref": "#/$defs/color"
                },
                "border": {
                  "$ref": "#/$defs/color"
                }
              },
              "additionalProperties": false
            },
            "content": {
              "type": "object",
              "properties": {
                "padding": {
                  "type": "number",
                  "minimum": 0,
                  "maximum": 64,
                  "description": "Inner padding in px."
                }
              },
              "additionalProperties": false
            }
          },
          "additionalProperties": false
        }
      },
      "additionalProperties": false
    }
  }
}
