{
  "schemaVersion": "1.0",
  "theme": "chiaro",
  "label": "Chiaro",
  "mode": "light",
  "tokens": {
    "colors": {
      "primary": "#1f5fbf",
      "onPrimary": "#ffffff",
      "background": "#f4f6f9",
      "surface": "#ffffff",
      "onSurface": "#1b2430",
      "mutedText": "#5d6b7a",
      "border": "#d5dbe3",
      "danger": "#c62828",
      "success": "#2e7d32"
    },
    "typography": { "fontFamily": "Segoe UI, Roboto, Arial, sans-serif", "baseSize": 15 },
    "shape": { "radius": 6 },
    "density": "comfortable"
  }
}
