{
  "schemaVersion": "1.0",
  "theme": "dark",
  "label": "Dark compact",
  "mode": "dark",
  "tokens": {
    "colors": {
      "primary": "#6aa6ff",
      "onPrimary": "#0b1220",
      "background": "#0f141b",
      "surface": "#1a222d",
      "onSurface": "#e6ebf2",
      "mutedText": "#9aa8b8",
      "border": "#2e3a49",
      "danger": "#ff6b6b",
      "success": "#5fd38d"
    },
    "typography": {
      "fontFamily": "Segoe UI, Roboto, Arial, sans-serif",
      "baseSize": 14
    },
    "shape": {
      "radius": 2
    },
    "density": "compact",
    "layout": {
      "sider": {
        "tone": "dark",
        "background": "#141b24",
        "text": "#d7dee8",
        "mutedText": "#9aa8b8",
        "activeBackground": "#1d3252",
        "activeText": "#6aa6ff",
        "border": "#2e3a49",
        "width": 256,
        "collapsedWidth": 80
      },
      "header": {
        "background": "#1a222d",
        "text": "#e6ebf2",
        "height": 56
      },
      "pageHeader": {
        "background": "#1a222d"
      },
      "content": {
        "padding": 24
      }
    }
  }
}
